tweet_id,timestamp,text,expanded_urls,rating_numerator,rating_denominator,name,The Real Source,dog_type,jpg_url,img_num,breed,retweet_count,favorite_count
774639387460112384,2016-09-10 16:03:16+00:00,This is Sprinkles. He's trapped in light jail. 10/10 would post bail for him https://t.co/4s5Xlijogu,"https://twitter.com/dog_rates/status/774639387460112384/photo/1,https://twitter.com/dog_rates/status/774639387460112384/photo/1",10,10,Sprinkles,Twitter for iPhone,,https://pbs.twimg.com/media/CsASZqRW8AA3Szw.jpg,1,walker hound,1604,6330
774314403806253056,2016-09-09 18:31:54+00:00,I WAS SENT THE ACTUAL DOG IN THE PROFILE PIC BY HIS OWNER THIS IS SO WILD. 14/10 ULTIMATE LEGEND STATUS https://t.co/7oQ1wpfxIH,"https://twitter.com/dog_rates/status/774314403806253056/photo/1,https://twitter.com/dog_rates/status/774314403806253056/photo/1,https://twitter.com/dog_rates/status/774314403806253056/photo/1,https://twitter.com/dog_rates/status/774314403806253056/photo/1",14,10,,Twitter for iPhone,,https://pbs.twimg.com/media/Cr7q1VxWIAA5Nm7.jpg,3,eskimo dog,5050,20437
773985732834758656,2016-09-08 20:45:53+00:00,Meet Winnie. She just made awkward eye contact with the driver beside her. Poor pupper panicked. 11/10 would comfort https://t.co/RFWtDqTnAz,"https://twitter.com/dog_rates/status/773985732834758656/photo/1,https://twitter.com/dog_rates/status/773985732834758656/photo/1,https://twitter.com/dog_rates/status/773985732834758656/photo/1,https://twitter.com/dog_rates/status/773985732834758656/photo/1",11,10,Winnie,Twitter for iPhone,pupper,https://pbs.twimg.com/media/Cr2_6R8WAAAUMtc.jpg,4,pug,3560,10106
773922284943896577,2016-09-08 16:33:46+00:00,"This is Heinrich (pronounced ""Pat""). He's a Botswanian Vanderfloof. Snazzy af bandana. 12/10 downright puptacular https://t.co/G56ikYAqFg",https://twitter.com/dog_rates/status/773922284943896577/photo/1,12,10,Heinrich,Twitter for iPhone,,https://pbs.twimg.com/media/Cr2GNdlW8AAbojw.jpg,1,pomeranian,1613,6032
773704687002451968,2016-09-08 02:09:06+00:00,This is Loki. He knows he's adorable. One ear always pupared. 12/10 would snug in depicted fashion forever https://t.co/OqNggd4Oio,"https://twitter.com/dog_rates/status/773704687002451968/photo/1,https://twitter.com/dog_rates/status/773704687002451968/photo/1",12,10,Loki,Twitter for iPhone,,https://pbs.twimg.com/media/CrzATQqWAAEHq2t.jpg,2,silky terrier,1485,6210
773670353721753600,2016-09-07 23:52:41+00:00,This is Shakespeare. He appears to be maximum level pettable. Born with no eyes tho (tragic). 10/10 probably wise https://t.co/rA8WUVOLBr,https://twitter.com/dog_rates/status/773670353721753600/photo/1,10,10,Shakespeare,Twitter for iPhone,,https://pbs.twimg.com/media/CryhFC0XEAA9wp_.jpg,1,old english sheepdog,1217,5035
773547596996571136,2016-09-07 15:44:53+00:00,This is Chelsea. She forgot how to dog. 11/10 get it together pupper https://t.co/nBJ5RE4yHb,https://twitter.com/dog_rates/status/773547596996571136/photo/1,11,10,Chelsea,Twitter for iPhone,pupper,https://pbs.twimg.com/media/Crwxb5yWgAAX5P_.jpg,1,norwegian elkhound,5652,20715
773308824254029826,2016-09-06 23:56:05+00:00,This is Bungalo. She uses that face to get what she wants. It works unbelievably well. 12/10 would never say no to https://t.co/0Fcft7jl4N,https://twitter.com/dog_rates/status/773308824254029826/photo/1,12,10,Bungalo,Twitter for iPhone,,https://pbs.twimg.com/media/CrtYRMEWIAAUkCl.jpg,1,labrador retriever,6908,21880
773247561583001600,2016-09-06 19:52:39+00:00,This is Chip. He's a pupholder. Comes with the car. Requires frequent pettings. Shifts for you. 10/10 innovative af https://t.co/hG5WYT9ECn,https://twitter.com/dog_rates/status/773247561583001600/photo/1,10,10,Chip,Twitter for iPhone,,https://pbs.twimg.com/media/Crsgi9dWEAApQd8.jpg,1,miniature pinscher,2985,8842
773191612633579521,2016-09-06 16:10:20+00:00,This is Grey. He's the dogtor in charge of your checkpup today. 12/10 I'd never miss an appointment https://t.co/9HEVPJEioD,"https://twitter.com/dog_rates/status/773191612633579521/photo/1,https://twitter.com/dog_rates/status/773191612633579521/photo/1",12,10,Grey,Twitter for iPhone,,https://pbs.twimg.com/media/CrrtqjdXEAINleR.jpg,1,blenheim spaniel,3779,9336
772877495989305348,2016-09-05 19:22:09+00:00,You need to watch these two doggos argue through a cat door. Both 11/10 https://t.co/qEP31epKEV,https://twitter.com/dog_rates/status/772877495989305348/video/1,11,10,,Twitter Web Client,,https://pbs.twimg.com/ext_tw_video_thumb/772874595468795904/pu/img/t8gbjy2rA19xtQYR.jpg,1,norwegian elkhound,3562,8011
772826264096874500,2016-09-05 15:58:34+00:00,"Meet Roosevelt. He's preparing for takeoff. Make sure tray tables are in their full pupright &amp; licked position
11/10 https://t.co/7CQkn3gHOQ",https://twitter.com/dog_rates/status/772826264096874500/photo/1,11,10,Roosevelt,Twitter for iPhone,,https://pbs.twimg.com/media/CrmhYYIXEAEcyYY.jpg,1,basset,2194,7540
772581559778025472,2016-09-04 23:46:12+00:00,Guys this is getting so out of hand. We only rate dogs. This is a Galapagos Speed Panda. Pls only send dogs... 10/10 https://t.co/8lpAGaZRFn,"https://twitter.com/dog_rates/status/772581559778025472/photo/1,https://twitter.com/dog_rates/status/772581559778025472/photo/1,https://twitter.com/dog_rates/status/772581559778025472/photo/1",10,10,,Twitter for iPhone,,https://pbs.twimg.com/media/CrjC0JAWAAAjz6n.jpg,3,newfoundland,1574,6077
772193107915964416,2016-09-03 22:02:38+00:00,This is Willem. He's a Penn State pupper. Thinks the hood makes him more intimidating. It doesn't. 12/10 https://t.co/Dp0s7MRIHK,https://twitter.com/dog_rates/status/772193107915964416/photo/1,12,10,Willem,Twitter for iPhone,pupper,https://pbs.twimg.com/media/Crdhh_1XEAAHKHi.jpg,1,pembroke,1278,5654
772152991789019136,2016-09-03 19:23:13+00:00,Here's a couple rufferees making sure all the sports are played fairly today. Both 10/10 would bribe with extra pets https://t.co/H9yjI9eo3A,"https://twitter.com/dog_rates/status/772152991789019136/photo/1,https://twitter.com/dog_rates/status/772152991789019136/photo/1",10,10,,Twitter for iPhone,,https://pbs.twimg.com/media/Crc9DEoWEAE7RLH.jpg,2,golden retriever,1047,3569
772117678702071809,2016-09-03 17:02:54+00:00,Meet Jack. He's a Clemson pup. Appears to be rather h*ckin pettable. Almost makes me want to root for Clemson. 12/10 https://t.co/GHOfbTVQti,https://twitter.com/dog_rates/status/772117678702071809/photo/1,12,10,Jack,Twitter for iPhone,,https://pbs.twimg.com/media/Crcc7pqXEAAM5O2.jpg,1,labrador retriever,682,3531
772114945936949249,2016-09-03 16:52:02+00:00,This is Finn. He's very nervous for the game. Has a lot of money riding on it.10/10 would attempt to comfort https://t.co/CbtNfecWiT,https://twitter.com/dog_rates/status/772114945936949249/photo/1,10,10,Finn,Twitter for iPhone,,https://pbs.twimg.com/media/Crcacf9WgAEcrMh.jpg,1,chihuahua,437,2569
772102971039580160,2016-09-03 16:04:27+00:00,This is Penny. She's an OU cheerleader. About to do a triple back handspring down the stairs. 11/10 hype af https://t.co/B2f3XkGU5c,https://twitter.com/dog_rates/status/772102971039580160/photo/1,11,10,Penny,Twitter for iPhone,,https://pbs.twimg.com/media/CrcPjh0WcAA_SPT.jpg,1,pembroke,858,3757
771770456517009408,2016-09-02 18:03:10+00:00,This is Davey. He'll have your daughter home by 8. Just a stand up pup. 11/10 would introduce to mom https://t.co/E6bGWf9EOm,https://twitter.com/dog_rates/status/771770456517009408/photo/1,11,10,Davey,Twitter for iPhone,,https://pbs.twimg.com/media/CrXhIqBW8AA6Bse.jpg,1,papillon,3123,11222
771500966810099713,2016-09-02 00:12:18+00:00,This is Dakota. He's just saying hi. That's all. 12/10 someone wave back https://t.co/1tWe5zZoHv,https://twitter.com/dog_rates/status/771500966810099713/photo/1,12,10,Dakota,Twitter for iPhone,,https://pbs.twimg.com/media/CrTsCPHWYAANdzC.jpg,1,labrador retriever,2405,7735
771380798096281600,2016-09-01 16:14:48+00:00,Meet Fizz. She thinks love is a social construct consisting solely of ideals perpetuated by mass media 11/10 woke af https://t.co/sPB5JMnWBn,"https://twitter.com/dog_rates/status/771380798096281600/photo/1,https://twitter.com/dog_rates/status/771380798096281600/photo/1,https://twitter.com/dog_rates/status/771380798096281600/photo/1,https://twitter.com/dog_rates/status/771380798096281600/photo/1",11,10,Fizz,Twitter for iPhone,,https://pbs.twimg.com/media/CrR-vVfXEAAk6Gg.jpg,1,collie,4636,9868
771136648247640064,2016-09-01 00:04:38+00:00,This is Dixie. She wants to be a ship captain. Won't let anything get in between her and her dreams. 11/10 https://t.co/8VEDZKHddR,https://twitter.com/dog_rates/status/771136648247640064/photo/1,11,10,Dixie,Twitter for iPhone,,https://pbs.twimg.com/media/CrOgsIBWYAA8Dtb.jpg,1,golden retriever,2696,8568
771102124360998913,2016-08-31 21:47:27+00:00,This is Charlie. He works for @TODAYshow. Super sneaky tongue slip here. 12/10 would pet until someone made me stop https://t.co/K5Jo7QRCvA,https://twitter.com/dog_rates/status/771102124360998913/photo/1,12,10,Charlie,Twitter for iPhone,,https://pbs.twimg.com/media/CrOBSfgXgAABsTE.jpg,1,labrador retriever,1323,5837
770787852854652928,2016-08-31 00:58:39+00:00,This is Winston. His tongue has gone rogue. Doing him quite a frighten. 10/10 hang in there Winston https://t.co/d0QEbp78Yi,https://twitter.com/dog_rates/status/770787852854652928/photo/1,10,10,Winston,Twitter for iPhone,,https://pbs.twimg.com/media/CrJjdZmXgAEWLSD.jpg,1,bernese mountain dog,1097,4598
770772759874076672,2016-08-30 23:58:40+00:00,This is Sebastian. He's super h*ckin fluffy. That's really all you need to know. 11/10 would snug intensely https://t.co/lqr0NdtwQo,https://twitter.com/dog_rates/status/770772759874076672/photo/1,11,10,Sebastian,Twitter for iPhone,,https://pbs.twimg.com/media/CrJVupHXgAA4Dkk.jpg,1,chow,1316,4861
770414278348247044,2016-08-30 00:14:12+00:00,Meet Al Cabone. He's a gangsta puppa. Rather h*ckin ruthless. Shows no mercy sometimes. 11/10 pet w extreme caution https://t.co/OUwWbEKOUV,https://twitter.com/dog_rates/status/770414278348247044/photo/1,11,10,Al,Twitter for iPhone,,https://pbs.twimg.com/media/CrEPsfWXEAAKvem.jpg,1,golden retriever,1916,5911
770293558247038976,2016-08-29 16:14:30+00:00,This is Jackson. There's nothing abnormal about him. Just your average really good dog. 10/10 https://t.co/3fEPpj0KYw,https://twitter.com/dog_rates/status/770293558247038976/photo/1,10,10,Jackson,Twitter for iPhone,,https://pbs.twimg.com/media/CrCh5RgW8AAXW4U.jpg,1,italian greyhound,1344,5824
770069151037685760,2016-08-29 01:22:47+00:00,Say hello to Carbon. This is his first time swimming. He's having a h*ckin blast. 10/10 we should all be this happy https://t.co/mADHGenzFS,https://twitter.com/dog_rates/status/770069151037685760/photo/1,10,10,Carbon,Twitter for iPhone,,https://pbs.twimg.com/media/Cq_Vy9KWcAIUIuv.jpg,1,boston bull,2114,7108
769940425801170949,2016-08-28 16:51:16+00:00,This is Klein. These pics were taken a month apart. He knows he's a stud now. 12/10 total heartthrob https://t.co/guDkLrX8zV,"https://twitter.com/dog_rates/status/769940425801170949/photo/1,https://twitter.com/dog_rates/status/769940425801170949/photo/1",12,10,Klein,Twitter for iPhone,,https://pbs.twimg.com/media/Cq9guJ5WgAADfpF.jpg,1,miniature pinscher,8769,29118
769695466921623552,2016-08-28 00:37:54+00:00,This is Titan. He's trying to make friends. Offering up his favorite stick. 13/10 philanthropic af https://t.co/vhrkz0dK4v,https://twitter.com/dog_rates/status/769695466921623552/photo/1,13,10,Titan,Twitter for iPhone,,https://pbs.twimg.com/media/Cq6B8V6XYAA1T1R.jpg,1,pug,1547,6017
769212283578875904,2016-08-26 16:37:54+00:00,This is DonDon. He's way up but doesn't feel blessed. Rather uncomfortable actually. 12/10 I'll save you DonDon https://t.co/OCYLz3fjVE,https://twitter.com/dog_rates/status/769212283578875904/photo/1,12,10,DonDon,Twitter for iPhone,,https://pbs.twimg.com/media/CqzKfQgXEAAWIY-.jpg,1,golden retriever,1588,5058
768970937022709760,2016-08-26 00:38:52+00:00,This is Kirby. His bowl weighs more than him. 12/10 would assist https://t.co/UlB2mzw3Xs,https://twitter.com/dog_rates/status/768970937022709760/video/1,12,10,Kirby,Twitter Web Client,,https://pbs.twimg.com/ext_tw_video_thumb/768967618174877700/pu/img/4wfsrs0ZnQ5pstXm.jpg,1,pomeranian,5960,13338
768855141948723200,2016-08-25 16:58:45+00:00,This is Jesse. He really wants a belly rub. Will be as cute as possible to achieve that goal. 11/10 https://t.co/1BxxcdVNJ8,https://twitter.com/dog_rates/status/768855141948723200/photo/1,11,10,Jesse,Twitter for iPhone,,https://pbs.twimg.com/media/CquFrCKWAAAr32m.jpg,1,chow,816,3915
768609597686943744,2016-08-25 00:43:02+00:00,This is Lou. His sweater is too small and he already cut the tags off. Very very churlish. 10/10 would still pet https://t.co/dZPMLresEr,https://twitter.com/dog_rates/status/768609597686943744/photo/1,10,10,Lou,Twitter for iPhone,,https://pbs.twimg.com/media/CqqmWa7WcAAIM-n.jpg,1,basenji,1091,3839
768596291618299904,2016-08-24 23:50:10+00:00,Say hello to Oakley and Charlie. They're convinced that they each have their own stick. Nobody tell them. Both 12/10 https://t.co/J2AJdyxglH,https://twitter.com/dog_rates/status/768596291618299904/photo/1,12,10,Oakley,Twitter for iPhone,,https://pbs.twimg.com/media/CqqaPjqWIAAOyNL.jpg,1,great pyrenees,1183,4720
768473857036525572,2016-08-24 15:43:39+00:00,Meet Chevy. He had a late breakfast and now has to choose between a late lunch or an early dinner. 11/10 very pupset https://t.co/goy9053wC7,https://twitter.com/dog_rates/status/768473857036525572/photo/1,11,10,Chevy,Twitter for iPhone,,https://pbs.twimg.com/media/Cqoq5PGWAAA-U8T.jpg,1,labrador retriever,3143,12710
767754930266464257,2016-08-22 16:06:54+00:00,This is Philbert. His toilet broke and he doesn't know what to do. Trying not to panic. 11/10 furustrated af https://t.co/Nb68IsVb9O,https://twitter.com/dog_rates/status/767754930266464257/photo/1,11,10,Philbert,Twitter for iPhone,,https://pbs.twimg.com/media/CqedCQWWgAIab9L.jpg,1,vizsla,4929,14901
767500508068192258,2016-08-21 23:15:55+00:00,This is Louie. He's making quite a h*ckin mess. Doesn't seem to care. 12/10 jubilant af https://t.co/Z2g2YWPzX2,https://twitter.com/dog_rates/status/767500508068192258/photo/1,12,10,Louie,Twitter for iPhone,,https://pbs.twimg.com/media/Cqa1ofnXEAAG0yn.jpg,1,chow,2129,7009
767122157629476866,2016-08-20 22:12:29+00:00,This is Rupert. You betrayed him with bath time but he forgives you. Cuddly af 13/10 https://t.co/IEARC2sRzC,"https://twitter.com/dog_rates/status/767122157629476866/photo/1,https://twitter.com/dog_rates/status/767122157629476866/photo/1",13,10,Rupert,Twitter for iPhone,,https://pbs.twimg.com/media/CqVdiBJWIAEDZB4.jpg,2,toy poodle,2624,9504
766793450729734144,2016-08-20 00:26:19+00:00,This is Rufus. He just missed out on the 100m final at Rio. Already training hard for Tokyo. 10/10 never give pup https://t.co/exrRjjJqeO,https://twitter.com/dog_rates/status/766793450729734144/photo/1,10,10,Rufus,Twitter for iPhone,,https://pbs.twimg.com/media/CqQykxrWYAAlD8g.jpg,1,beagle,1245,4719
766693177336135680,2016-08-19 17:47:52+00:00,This is Brudge. He's a Doberdog. Going to be h*ckin massive one day. 11/10 would pat on head approvingly https://t.co/cTlHjEUNK8,https://twitter.com/dog_rates/status/766693177336135680/photo/1,11,10,Brudge,Twitter for iPhone,,https://pbs.twimg.com/media/CqPXYLLXEAAU2HC.jpg,1,doberman,727,3775
766423258543644672,2016-08-18 23:55:18+00:00,This is Shadoe. Her tongue flies out of her mouth at random. Can't have a serious conversation with her. 9/10 https://t.co/Tytt15VquG,"https://twitter.com/dog_rates/status/766423258543644672/photo/1,https://twitter.com/dog_rates/status/766423258543644672/photo/1",9,10,Shadoe,Twitter for iPhone,,https://pbs.twimg.com/media/CqLh4yJWcAAHomv.jpg,2,keeshond,1444,5605
766313316352462849,2016-08-18 16:38:26+00:00,This is Oscar. He has legendary eyebrows and he h*ckin knows it. Curly af too. 12/10 would hug passionately https://t.co/xuxZoObmF0,https://twitter.com/dog_rates/status/766313316352462849/photo/1,12,10,Oscar,Twitter for iPhone,,https://pbs.twimg.com/media/CqJ95SRWgAATPK_.jpg,1,toy poodle,1722,6316
766069199026450432,2016-08-18 00:28:24+00:00,This is Juno. She can see your future. 12/10 h*ckin mesmerizing af https://t.co/Z69mShifuk,https://twitter.com/dog_rates/status/766069199026450432/photo/1,12,10,Juno,Twitter for iPhone,,https://pbs.twimg.com/media/CqGf3xaXYAEh3ak.jpg,1,redbone,767,3919
766008592277377025,2016-08-17 20:27:34+00:00,This is Angel. She stole the @ShopWeRateDogs shirt from her owner. Fits pretty well actually. 11/10 would forgive https://t.co/jaivZ1dcUL,https://twitter.com/dog_rates/status/766008592277377025/photo/1,11,10,Angel,Twitter for iPhone,,https://pbs.twimg.com/media/CqFouXOXYAAYpzG.jpg,1,welsh springer spaniel,455,3522
765719909049503744,2016-08-17 01:20:27+00:00,This is Brat. He has a hard time being ferocious so his owner helps out. H*ckin scary af now. 12/10 would still pet https://t.co/soxdNqZDZ2,https://twitter.com/dog_rates/status/765719909049503744/photo/1,12,10,Brat,Twitter for iPhone,,https://pbs.twimg.com/media/CqBiMAgWAAEJKgI.jpg,1,golden retriever,1978,6770
765669560888528897,2016-08-16 22:00:23+00:00,This is Tove. She's a Balsamic Poinsetter. Surprisingly deadly. 12/10 snug with caution https://t.co/t6RvnVEdRR,"https://twitter.com/dog_rates/status/765669560888528897/photo/1,https://twitter.com/dog_rates/status/765669560888528897/photo/1,https://twitter.com/dog_rates/status/765669560888528897/photo/1",12,10,Tove,Twitter for iPhone,,https://pbs.twimg.com/media/CqA0XcYWAAAzltT.jpg,1,beagle,1126,4833
765395769549590528,2016-08-16 03:52:26+00:00,This is my dog. Her name is Zoey. She knows I've been rating other dogs. She's not happy. 13/10 no bias at all https://t.co/ep1NkYoiwB,https://twitter.com/dog_rates/status/765395769549590528/photo/1,13,10,,Twitter for iPhone,,https://pbs.twimg.com/media/Cp87Y0jXYAQyjuV.jpg,1,pembroke,3090,24996
765371061932261376,2016-08-16 02:14:15+00:00,This is Louie. He's had a long day. Did a lot of pupper things. Also appears to be rather heckin pettable. 11/10 https://t.co/w2qDmoTIZ5,"https://twitter.com/dog_rates/status/765371061932261376/photo/1,https://twitter.com/dog_rates/status/765371061932261376/photo/1",11,10,Louie,Twitter for iPhone,pupper,https://pbs.twimg.com/media/Cp8k6oRWcAUL78U.jpg,2,golden retriever,1989,6653
765222098633691136,2016-08-15 16:22:20+00:00,This is Gromit. He's pupset because there's no need to beware of him. Just wants a pettin. 10/10 https://t.co/eSvz4EapHH,https://twitter.com/dog_rates/status/765222098633691136/photo/1,10,10,Gromit,Twitter for iPhone,,https://pbs.twimg.com/media/Cp6db4-XYAAMmqL.jpg,1,dalmatian,3094,10867
764857477905154048,2016-08-14 16:13:27+00:00,This is Aubie. He has paws for days. Nibbling tables is one of his priorities. Second only to being cuddly af. 12/10 https://t.co/cBIFBsCRz6,https://twitter.com/dog_rates/status/764857477905154048/photo/1,12,10,Aubie,Twitter for iPhone,,https://pbs.twimg.com/media/Cp1R0ZTWcAAaPO4.jpg,1,bernese mountain dog,1639,6052
764259802650378240,2016-08-13 00:38:30+00:00,This is Kota and her son Benedict. She doesn't know why you're staring. They are a normal family. Both 10/10 https://t.co/Q1v9BZylvZ,"https://twitter.com/dog_rates/status/764259802650378240/photo/1,https://twitter.com/dog_rates/status/764259802650378240/photo/1",10,10,Kota,Twitter for iPhone,,https://pbs.twimg.com/media/CpsyNtXWgAAqvs3.jpg,1,german shepherd,1383,5610
763837565564780549,2016-08-11 20:40:41+00:00,This is Alfie. He's touching a butt. Couldn't be happier. 11/10 https://t.co/gx3xF5mZbo,https://twitter.com/dog_rates/status/763837565564780549/photo/1,11,10,Alfie,Twitter for iPhone,,https://pbs.twimg.com/media/CpmyNumW8AAAJGj.jpg,1,malamute,3781,11702
763183847194451968,2016-08-10 01:23:03+00:00,This is Clark. He collects teddy bears. It's absolutely h*ckin horrifying. 8/10 please stop this Clark https://t.co/EDMcwt86fU,https://twitter.com/dog_rates/status/763183847194451968/photo/1,8,10,Clark,Twitter for iPhone,,https://pbs.twimg.com/media/CpdfpzKWYAAWSUi.jpg,1,miniature poodle,1347,5038
763103485927849985,2016-08-09 20:03:43+00:00,This is Belle. She's a Butterflop Hufflepoof. Rarer than most. Having trouble with car seat. 10/10 perturbed af https://t.co/VIXT3D26VM,"https://twitter.com/dog_rates/status/763103485927849985/photo/1,https://twitter.com/dog_rates/status/763103485927849985/photo/1",10,10,Belle,Twitter for iPhone,,https://pbs.twimg.com/media/CpcWknPXYAAeLP9.jpg,2,chow,2103,6886
762699858130116608,2016-08-08 17:19:51+00:00,This is Leela. She's a Fetty Woof. Lost eye while saving a baby from an avalanche. 11/10 true h*ckin hero https://t.co/2lBg3ZgivD,https://twitter.com/dog_rates/status/762699858130116608/photo/1,11,10,Leela,Twitter for iPhone,,https://pbs.twimg.com/media/CpWnecZWIAAUFwt.jpg,1,kelpie,3286,11306
762471784394268675,2016-08-08 02:13:34+00:00,Meet Glenn. Being in public scares him. Frighteningly relatable. 12/10 keep hangin in there Glenn (Imgur - Wuhahha) https://t.co/pA4MDKwRci,https://twitter.com/dog_rates/status/762471784394268675/video/1,12,10,Glenn,Twitter for iPhone,,https://pbs.twimg.com/ext_tw_video_thumb/762471745303355393/pu/img/RKcEUz7-VDipoGKJ.jpg,1,samoyed,5866,10464
762464539388485633,2016-08-08 01:44:46+00:00,This is Buddy. His father was a bear and his mother was a perfectly toasted marshmallow. 12/10 would snug so well https://t.co/zGSj1oUgxx,"https://twitter.com/dog_rates/status/762464539388485633/photo/1,https://twitter.com/dog_rates/status/762464539388485633/photo/1,https://twitter.com/dog_rates/status/762464539388485633/photo/1,https://twitter.com/dog_rates/status/762464539388485633/photo/1",12,10,Buddy,Twitter for iPhone,,https://pbs.twimg.com/media/CpTRc4DUEAAYTq6.jpg,4,chow,3800,9601
761976711479193600,2016-08-06 17:26:19+00:00,This is Shelby. She finds stuff to put on her head for attention. It works really well. 12/10 talented af https://t.co/WTZ484EntP,"https://twitter.com/dog_rates/status/761976711479193600/photo/1,https://twitter.com/dog_rates/status/761976711479193600/photo/1,https://twitter.com/dog_rates/status/761976711479193600/photo/1,https://twitter.com/dog_rates/status/761976711479193600/photo/1",12,10,Shelby,Twitter for iPhone,,https://pbs.twimg.com/media/CpMVxoRXgAAh350.jpg,3,labrador retriever,1811,5014
761599872357261312,2016-08-05 16:28:54+00:00,"This is Sephie. According to this picture, she can read. Fantastic at following directions. 11/10 such a good girl https://t.co/7HY9RvCudo",https://twitter.com/dog_rates/status/761599872357261312/photo/1,11,10,Sephie,Twitter for iPhone,,https://pbs.twimg.com/media/CpG_CrlWYAYyuP3.jpg,1,gordon setter,1093,3862
761334018830917632,2016-08-04 22:52:29+00:00,This is Bruce. I really want to hear the joke he was told. 10/10 for chuckle pup https://t.co/ErPLjjJOKc,https://twitter.com/dog_rates/status/761334018830917632/photo/1,10,10,Bruce,Twitter for iPhone,,https://pbs.twimg.com/media/CpDNQGkWEAENiYZ.jpg,1,norwegian elkhound,1330,4807
761292947749015552,2016-08-04 20:09:17+00:00,Meet Bonaparte. He's pupset because it's cloudy at the beach. Can't take any pics for his Instagram. 11/10 https://t.co/0THNOfv2Jo,https://twitter.com/dog_rates/status/761292947749015552/photo/1,11,10,Bonaparte,Twitter for iPhone,,https://pbs.twimg.com/media/CpCn5aXXgAAOPTm.jpg,1,standard poodle,994,4170
761227390836215808,2016-08-04 15:48:47+00:00,This is Albert. He just found out that bees are dying globally at an alarming rate. 10/10 heckin worried af now https://t.co/nhLX27WsDY,https://twitter.com/dog_rates/status/761227390836215808/photo/1,10,10,Albert,Twitter for iPhone,,https://pbs.twimg.com/media/CpBsRleW8AEfO8G.jpg,1,french bulldog,1434,4971
761004547850530816,2016-08-04 01:03:17+00:00,This is Bo and Ty. Bo eats paper and Ty felt left out. 11/10 for both https://t.co/1acHQS8rvK,https://twitter.com/dog_rates/status/761004547850530816/photo/1,11,10,Bo,Twitter for iPhone,,https://pbs.twimg.com/media/Co-hmcYXYAASkiG.jpg,1,golden retriever,3194,10604
760893934457552897,2016-08-03 17:43:45+00:00,This is Wishes. He has the day off. Daily struggles of being a doggo have finally caught up with him. 11/10 https://t.co/H9YgrUkYwa,https://twitter.com/dog_rates/status/760893934457552897/photo/1,11,10,Wishes,Twitter for iPhone,doggo,https://pbs.twimg.com/media/Co88_ujWEAErCg7.jpg,1,blenheim spaniel,881,3559
760656994973933572,2016-08-03 02:02:14+00:00,This is Rose. Her face is stuck like that. 11/10 would pet so heckin well https://t.co/tl3gNYdoq2,"https://twitter.com/dog_rates/status/760656994973933572/photo/1,https://twitter.com/dog_rates/status/760656994973933572/photo/1",11,10,Rose,Twitter for iPhone,,https://pbs.twimg.com/media/Co5lf-KW8AAIwJw.jpg,1,golden retriever,1736,6148
760539183865880579,2016-08-02 18:14:06+00:00,This is Atlas. Swinging is his passion. 12/10 would push all day https://t.co/9k8LLjJ0uJ,"https://twitter.com/dog_rates/status/760539183865880579/photo/1,https://twitter.com/dog_rates/status/760539183865880579/photo/1,https://twitter.com/dog_rates/status/760539183865880579/photo/1",12,10,Atlas,Twitter for iPhone,,https://pbs.twimg.com/media/Co36VZfWcAEN3R3.jpg,1,samoyed,3312,7043
760290219849637889,2016-08-02 01:44:48+00:00,This is Rocco. He's doing his best. 13/10 someone help him (IG: rocco_roni) https://t.co/qFsl1nnXMv,https://twitter.com/dog_rates/status/760290219849637889/video/1,13,10,Rocco,Twitter Web Client,,https://pbs.twimg.com/ext_tw_video_thumb/760289324994879489/pu/img/3ItvBEoo4aebPfvr.jpg,1,old english sheepdog,10504,24965
759846353224826880,2016-07-31 20:21:02+00:00,This is Kirby. He's a Beneblip Cumberpat. Pretty heckin rare. 11/10 would put my face against his face https://t.co/fd6uucghY6,https://twitter.com/dog_rates/status/759846353224826880/photo/1,11,10,Kirby,Twitter for iPhone,,https://pbs.twimg.com/media/CouEOZhWAAAgFpE.jpg,1,sussex spaniel,1786,6259
