tweet_id,timestamp,text,expanded_urls,rating_numerator,rating_denominator,name,The Real Source,dog_type,jpg_url,img_num,breed,retweet_count,favorite_count
828381636999917570,2017-02-05 23:15:47+00:00,Meet Doobert. He's a deaf doggo. Didn't stop him on the field tho. Absolute legend today. 14/10 would pat head approvingly https://t.co/iCk7zstRA9,https://twitter.com/dog_rates/status/828381636999917570/photo/1,14,10,Doobert,Twitter for iPhone,doggo,https://pbs.twimg.com/media/C38Asz1WEAAvzj3.jpg,1,bedlington terrier,2051,11809
828376505180889089,2017-02-05 22:55:23+00:00,"This is Beebop. Her name means ""Good Dog"" in robot. She also was a star on the field today. 13/10 would pet well https://t.co/HKBVZqXFNR",https://twitter.com/dog_rates/status/828376505180889089/photo/1,13,10,Beebop,Twitter for iPhone,,https://pbs.twimg.com/media/C378BwxWMAA6CNK.jpg,1,american staffordshire terrier,987,6965
828372645993398273,2017-02-05 22:40:03+00:00,This is Alexander Hamilpup. He was one of the many stars in this year's Puppy Bowl. He just hopes both teams had fun. 12/10 https://t.co/JcTuUcyYNS,https://twitter.com/dog_rates/status/828372645993398273/photo/1,12,10,Alexander,Twitter for iPhone,,https://pbs.twimg.com/media/C374hb0WQAAIbQ-.jpg,1,malamute,2711,11818
828011680017821696,2017-02-04 22:45:42+00:00,Say hello to Brutus and Jersey. They think they're the same size. Best furiends furever. Both 11/10 would pet simultaneously https://t.co/rkhCFfDtxB,"https://twitter.com/dog_rates/status/828011680017821696/photo/1,https://twitter.com/dog_rates/status/828011680017821696/photo/1",11,10,Brutus,Twitter for iPhone,,https://pbs.twimg.com/media/C32wOLcWYAAjNqS.jpg,1,american staffordshire terrier,1978,9733
827933404142436356,2017-02-04 17:34:40+00:00,This is Kona. Yesterday she stopped by the department to see what it takes to be a police pupper. 12/10 vest was only a smidge too big https://t.co/j8D3PQJvpJ,"https://twitter.com/dog_rates/status/827933404142436356/photo/1,https://twitter.com/dog_rates/status/827933404142436356/photo/1,https://twitter.com/dog_rates/status/827933404142436356/photo/1",12,10,Kona,Twitter for iPhone,pupper,https://pbs.twimg.com/media/C31pCN4UcAAOLNH.jpg,2,german shepherd,4796,18754
827653905312006145,2017-02-03 23:04:02+00:00,This is Boots. She doesn't know what to do with treats so she just holds them. Very good girl. 12/10 would give more treats https://t.co/eAA8lratd3,https://twitter.com/dog_rates/status/827653905312006145/photo/1,12,10,Boots,Twitter for iPhone,,https://pbs.twimg.com/media/C3xq1ZeWEAEuzw3.jpg,1,collie,2786,14529
827600520311402496,2017-02-03 19:31:54+00:00,Meet Tucker. It's his birthday. He's pupset with you because you're too busy playing @GoodDogsGame to celebrate. 13/10 would put down phone https://t.co/vrppizPGdb,https://twitter.com/dog_rates/status/827600520311402496/photo/1,13,10,Tucker,Twitter for iPhone,,https://pbs.twimg.com/media/C3w6RYbWQAAEQ25.jpg,1,pembroke,861,7031
827324948884643840,2017-02-03 01:16:53+00:00,"This is Ralphie. He's being treated for an overactive funny bone, which is no joke. 12/10 would try to pet with a straight face https://t.co/UU3KqQF5n5",https://twitter.com/dog_rates/status/827324948884643840/photo/1,12,10,Ralphie,Twitter for iPhone,,https://pbs.twimg.com/media/C3s_pYrXAAA1eqZ.jpg,1,golden retriever,2790,14880
827199976799354881,2017-02-02 17:00:17+00:00,This is Charlie. He wins every game of chess he plays. Won't let opponent pet him until they forfeit. 13/10 you win again Charlie https://t.co/UkyQibIBzZ,"https://twitter.com/dog_rates/status/827199976799354881/photo/1,https://twitter.com/dog_rates/status/827199976799354881/photo/1,https://twitter.com/dog_rates/status/827199976799354881/photo/1,https://twitter.com/dog_rates/status/827199976799354881/photo/1",13,10,Charlie,Twitter for iPhone,,https://pbs.twimg.com/media/C3rN-lcWEAA9CmR.jpg,4,great dane,2047,9956
826958653328592898,2017-02-02 01:01:21+00:00,This is Loki. He smiles like Elvis. Ain't nothin but a hound doggo. 12/10 https://t.co/QV5nx6otZR,https://twitter.com/dog_rates/status/826958653328592898/photo/1,12,10,Loki,Twitter for iPhone,doggo,https://pbs.twimg.com/media/C3nygbBWQAAjwcW.jpg,1,golden retriever,4576,20222
826848821049180160,2017-02-01 17:44:55+00:00,This is Cupid. He was found in the trash. Now he's well on his way to prosthetic front legs and a long happy doggo life. 13/10 heroic af https://t.co/WS0Gha8vRh,"https://twitter.com/dog_rates/status/826848821049180160/photo/1,https://twitter.com/dog_rates/status/826848821049180160/photo/1,https://twitter.com/dog_rates/status/826848821049180160/photo/1,https://twitter.com/dog_rates/status/826848821049180160/photo/1",13,10,Cupid,Twitter for iPhone,doggo,https://pbs.twimg.com/media/C3mOnZ_XUAAjr2V.jpg,4,great pyrenees,9282,33871
826598365270007810,2017-02-01 01:09:42+00:00,This is Pawnd... James Pawnd. He's suave af. 13/10 would trust with my life https://t.co/YprN62Z74I,"https://twitter.com/dog_rates/status/826598365270007810/photo/1,https://twitter.com/dog_rates/status/826598365270007810/photo/1,https://twitter.com/dog_rates/status/826598365270007810/photo/1",13,10,Pawnd,Twitter for iPhone,,https://pbs.twimg.com/media/C3iq0EEXUAAdBYC.jpg,1,french bulldog,2171,9402
826476773533745153,2017-01-31 17:06:32+00:00,This is Pilot. He has mastered the synchronized head tilt and sneaky tongue slip. Usually not unlocked until later doggo days. 12/10 https://t.co/YIV8sw8xkh,https://twitter.com/dog_rates/status/826476773533745153/photo/1,12,10,Pilot,Twitter for iPhone,doggo,https://pbs.twimg.com/media/C3g8M0lWIAEcFgn.jpg,1,german shepherd,3874,17291
826240494070030336,2017-01-31 01:27:39+00:00,We only rate dogs. Please don't send in any more non-dogs like this Wild Albanian Street Moose. Thank you... 11/10 https://t.co/srXL2s868C,https://twitter.com/dog_rates/status/826240494070030336/photo/1,11,10,,Twitter for iPhone,,https://pbs.twimg.com/media/C3dlVMbXAAUd-Gh.jpg,1,french bulldog,2406,12472
826204788643753985,2017-01-30 23:05:46+00:00,"Here's a little more info on Dew, your favorite roaming doggo that went h*ckin viral. 13/10 
https://t.co/1httNYrCeW https://t.co/KvaM8j3jhX","http://us.blastingnews.com/news/2017/01/kentucky-teen-helps-lost-yellow-labrador-and-gets-a-huge-surprise-001431969.html?sbdht=_pM1QUzk3wsenGU1giO7UnJ5NGGiKRW9AD5xs2MkaDpYY13JxbtKE4w2_,https://twitter.com/dog_rates/status/826204788643753985/photo/1,https://twitter.com/dog_rates/status/826204788643753985/photo/1,https://twitter.com/dog_rates/status/826204788643753985/photo/1,https://twitter.com/dog_rates/status/826204788643753985/photo/1",13,10,,Twitter for iPhone,doggo,https://pbs.twimg.com/media/C3dEza1WcAAhlNU.jpg,2,labrador retriever,851,4578
826115272272650244,2017-01-30 17:10:04+00:00,This is Ike. He's demonstrating the pupmost restraint. 13/10 super good boy https://t.co/6gHoGah9nm,https://twitter.com/dog_rates/status/826115272272650244/photo/1,13,10,Ike,Twitter for iPhone,,https://pbs.twimg.com/media/C3bzVILWcAUjS5i.jpg,1,golden retriever,2844,14672
825829644528148480,2017-01-29 22:15:05+00:00,This is Toby. He just found out you only pretend to throw the ball sometimes. H*ckin puppalled. 12/10 would console https://t.co/YimNdkZrhM,"https://twitter.com/dog_rates/status/825829644528148480/photo/1,https://twitter.com/dog_rates/status/825829644528148480/photo/1",12,10,Toby,Twitter for iPhone,,https://pbs.twimg.com/media/C3XvqILXUAU2nnT.jpg,2,great pyrenees,2321,11963
825535076884762624,2017-01-29 02:44:34+00:00,Here's a very loving and accepting puppo. Appears to have read her Constitution well. 14/10 would pat head approvingly https://t.co/6ao80wIpV1,https://twitter.com/dog_rates/status/825535076884762624/photo/1,14,10,,Twitter for iPhone,puppo,https://pbs.twimg.com/media/C3TjvitXAAAI-QH.jpg,1,rottweiler,16269,53735
825147591692263424,2017-01-28 01:04:51+00:00,This is Sweet Pea. She hides in shoe boxes and waits for someone to pick her. Then she surpuprises them. 13/10 https://t.co/AyBEmx56MD,https://twitter.com/dog_rates/status/825147591692263424/photo/1,13,10,Sweet,Twitter for iPhone,,https://pbs.twimg.com/media/C3ODWpfXAAAP1fb.jpg,1,pekinese,4157,17172
825026590719483904,2017-01-27 17:04:02+00:00,"Say hello to Pablo. He's one gorgeous puppo. A true 12/10. Click the link to see why Pablo requests your assistance

https://t.co/koHvVQp9bL https://t.co/IhW0JKf7kc","https://www.gofundme.com/my-puppys-double-cataract-surgery,https://twitter.com/dog_rates/status/825026590719483904/photo/1,https://twitter.com/dog_rates/status/825026590719483904/photo/1",12,10,Pablo,Twitter for iPhone,puppo,https://pbs.twimg.com/media/C3MVTeHWcAAGNfx.jpg,2,eskimo dog,1162,5877
824775126675836928,2017-01-27 00:24:48+00:00,This is Scooter. His lack of opposable thumbs is rendering his resistance to tickling embarrassingly moot. 12/10 would keep tickling https://t.co/F0VWg2GztI,"https://twitter.com/dog_rates/status/824775126675836928/photo/1,https://twitter.com/dog_rates/status/824775126675836928/photo/1",12,10,Scooter,Twitter for iPhone,,https://pbs.twimg.com/media/C3Iwlr0WYAARVh4.jpg,1,border terrier,3253,13990
824663926340194305,2017-01-26 17:02:56+00:00,This is Wilson. Named after the volleyball. He tongue wrestled a bee and lost. 13/10 valiant effort tho https://t.co/A5Mx4h1FSM,https://twitter.com/dog_rates/status/824663926340194305/photo/1,13,10,Wilson,Twitter for iPhone,,https://pbs.twimg.com/media/C3HLd0HXUAAUI2b.jpg,1,english setter,1633,9897
824325613288833024,2017-01-25 18:38:36+00:00,Retweet the h*ck out of this 13/10 pupper #BellLetsTalk https://t.co/wBmc7OaGvS,https://twitter.com/dog_rates/status/824325613288833024/photo/1,13,10,,Twitter for iPhone,pupper,https://pbs.twimg.com/media/C3CXxaoWQAAiLuC.jpg,1,pembroke,9836,11110
823939628516474880,2017-01-24 17:04:50+00:00,This is Cash. He's officially given pup on today. 12/10 frighteningly relatable https://t.co/m0hrATIEyw,https://twitter.com/dog_rates/status/823939628516474880/photo/1,12,10,Cash,Twitter for iPhone,,https://pbs.twimg.com/media/C284uD8WgAEmMVn.jpg,1,schipperke,2518,10018
823699002998870016,2017-01-24 01:08:40+00:00,This is Winston. The goggles make him a superhero. Protects the entire city from criminals unless they rub his belly really well. 12/10 https://t.co/yCydYURYEL,https://twitter.com/dog_rates/status/823699002998870016/photo/1,12,10,Winston,Twitter for iPhone,,https://pbs.twimg.com/media/C25d3nkXEAAFBUN.jpg,1,cairn,2328,13138
823581115634085888,2017-01-23 17:20:14+00:00,This is Crawford. He's quite h*ckin good at the selfies. Nose is incredibly boopable. 11/10 would snapchat https://t.co/6F5Rrp472U,https://twitter.com/dog_rates/status/823581115634085888/photo/1,11,10,Crawford,Twitter for iPhone,,https://pbs.twimg.com/media/C23ypm6VQAAO31l.jpg,1,german shepherd,2431,12197
823322678127919110,2017-01-23 00:13:17+00:00,This is Wyatt. He's got the fastest paws in the West. H*ckin deadly. 11/10 would ride into the sunset with https://t.co/stkJ377KK7,"https://twitter.com/dog_rates/status/823322678127919110/photo/1,https://twitter.com/dog_rates/status/823322678127919110/photo/1",11,10,Wyatt,Twitter for iPhone,,https://pbs.twimg.com/media/C20HmaKWgAQ6-6X.jpg,2,chihuahua,3694,14755
822975315408461824,2017-01-22 01:12:59+00:00,This is Albus. He's soaked as h*ck. Seems to have misplaced an ear as well. Still in good spirits tho. 12/10 would dry https://t.co/yUM8jYStuG,https://twitter.com/dog_rates/status/822975315408461824/photo/1,12,10,Albus,Twitter for iPhone,,https://pbs.twimg.com/media/C2vLrpvWIAA3LM3.jpg,1,pembroke,3183,16291
822872901745569793,2017-01-21 18:26:02+00:00,Here's a super supportive puppo participating in the Toronto  #WomensMarch today. 13/10 https://t.co/nTz3FtorBc,https://twitter.com/dog_rates/status/822872901745569793/photo/1,13,10,,Twitter for iPhone,puppo,https://pbs.twimg.com/media/C2tugXLXgAArJO4.jpg,1,lakeland terrier,39663,123416
822859134160621569,2017-01-21 17:31:20+00:00,This is Hobbes. He was told he was going to the park. Ended up at the vet. H*ckin bamboozled. Quite pupset with you. 12/10 https://t.co/SSQE06XClS,https://twitter.com/dog_rates/status/822859134160621569/photo/1,12,10,Hobbes,Twitter for iPhone,,https://pbs.twimg.com/media/C2tiAzGXgAIFdqi.jpg,1,malinois,2100,12389
822610361945911296,2017-01-21 01:02:48+00:00,Please stop sending in non-canines like this Very Pettable Dozing Bath Tortoise. We only rate dogs. Only send dogs... 12/10 https://t.co/mcagPeENIh,https://twitter.com/dog_rates/status/822610361945911296/photo/1,12,10,,Twitter for iPhone,,https://pbs.twimg.com/media/C2p_wQyXEAELtvS.jpg,1,cocker spaniel,2713,13900
822489057087389700,2017-01-20 17:00:46+00:00,This is Paisley. She really wanted to be president this time. Dreams officially crushed. 13/10 https://t.co/liJGwMp17E,"https://twitter.com/dog_rates/status/822489057087389700/photo/1,https://twitter.com/dog_rates/status/822489057087389700/photo/1,https://twitter.com/dog_rates/status/822489057087389700/photo/1",13,10,Paisley,Twitter for iPhone,,https://pbs.twimg.com/media/C2oRbOuWEAAbVSl.jpg,1,samoyed,5921,17023
822462944365645825,2017-01-20 15:17:01+00:00,"This is Gabe. He was the unequivocal embodiment of a dream meme, but also one h*ck of a pupper. You will be missed by so many. 14/10 RIP https://t.co/M3hZGadUuO","https://twitter.com/dog_rates/status/822462944365645825/photo/1,https://twitter.com/dog_rates/status/822462944365645825/photo/1,https://twitter.com/dog_rates/status/822462944365645825/photo/1,https://twitter.com/dog_rates/status/822462944365645825/photo/1",14,10,Gabe,Twitter for iPhone,pupper,https://pbs.twimg.com/media/C2n5rUUXEAIXAtv.jpg,3,pomeranian,13055,26158
822244816520155136,2017-01-20 00:50:15+00:00,We only rate dogs. Please don't send pics of men capturing low level clouds. Thank you... 11/10 https://t.co/rLi83ZyCL5,https://twitter.com/dog_rates/status/822244816520155136/photo/1,11,10,,Twitter for iPhone,,https://pbs.twimg.com/media/C2kzTGxWEAEOpPL.jpg,1,samoyed,9165,32958
821886076407029760,2017-01-19 01:04:45+00:00,This is Jimison. He was just called a good boy. 13/10 https://t.co/djMep7mGkV,https://twitter.com/dog_rates/status/821886076407029760/photo/1,13,10,Jimison,Twitter for iPhone,,https://pbs.twimg.com/media/C2ftAxnWIAEUdAR.jpg,1,golden retriever,2125,10619
821765923262631936,2017-01-18 17:07:18+00:00,This is Duchess. She uses dark doggo forces to levitate her toys. 13/10 magical af https://t.co/maDNMETA52,https://twitter.com/dog_rates/status/821765923262631936/photo/1,13,10,Duchess,Twitter for iPhone,doggo,https://pbs.twimg.com/media/C2d_vnHWEAE9phX.jpg,1,golden retriever,1552,7877
821522889702862852,2017-01-18 01:01:34+00:00,This is Harlso. He has a really good idea but isn't sure you're going to like it. 13/10 he'll just keep it to himself https://t.co/IzcaR3Nqyn,https://twitter.com/dog_rates/status/821522889702862852/photo/1,13,10,Harlso,Twitter for iPhone,,https://pbs.twimg.com/media/C2aitIUXAAAG-Wi.jpg,1,doberman,1624,7530
821407182352777218,2017-01-17 17:21:47+00:00,This is Sundance. He's a doggo drummer. Even sings a bit on the side. 14/10 entertained af (vid by @sweetsundance) https://t.co/Xn5AQtiqzG,https://twitter.com/dog_rates/status/821407182352777218/video/1,14,10,Sundance,Twitter for iPhone,doggo,https://pbs.twimg.com/ext_tw_video_thumb/821407155391725568/pu/img/AJC07gFJDDBuwNTD.jpg,1,irish setter,3970,11048
821149554670182400,2017-01-17 00:18:04+00:00,This is Luca. He got caught howling. H*ckin embarrassed. 12/10 https://t.co/r8DxA8DYJ2,https://twitter.com/dog_rates/status/821149554670182400/video/1,12,10,Luca,Twitter for iPhone,,https://pbs.twimg.com/ext_tw_video_thumb/821149477142556673/pu/img/88_DV098c60pC5AA.jpg,1,german shepherd,1816,8069
821107785811234820,2017-01-16 21:32:06+00:00,Here's a doggo who looks like he's about to give you a list of mythical ingredients to go collect for his potion. 11/10 would obey https://t.co/8SiwKDlRcl,https://twitter.com/dog_rates/status/821107785811234820/photo/1,11,10,,Twitter for iPhone,doggo,https://pbs.twimg.com/media/C2UpLA-UcAEK_Fz.jpg,1,pomeranian,1957,9015
821044531881721856,2017-01-16 17:20:45+00:00,This is Flash. He went way too hard celebrating Martin Luther King Day last night. 12/10 now he's having a dream in his honor https://t.co/bryVdNaRcu,https://twitter.com/dog_rates/status/821044531881721856/photo/1,12,10,Flash,Twitter for iPhone,,https://pbs.twimg.com/media/C2Tvo20XcAAhNL9.jpg,1,old english sheepdog,2109,11873
820749716845686786,2017-01-15 21:49:15+00:00,Meet Sunny. He can take down a polar bear in one fell swoop. Fr*cken deadly af. 13/10 would pet with caution https://t.co/EMq8Ud6Ze1,"https://twitter.com/dog_rates/status/820749716845686786/photo/1,https://twitter.com/dog_rates/status/820749716845686786/photo/1",13,10,Sunny,Twitter for iPhone,,https://pbs.twimg.com/media/C2PjgjQXcAAc4Uu.jpg,2,golden retriever,9133,29665
820690176645140481,2017-01-15 17:52:40+00:00,The floofs have been released I repeat the floofs have been released. 84/70 https://t.co/NIYC820tmd,"https://twitter.com/dog_rates/status/820690176645140481/photo/1,https://twitter.com/dog_rates/status/820690176645140481/photo/1,https://twitter.com/dog_rates/status/820690176645140481/photo/1",84,70,,Twitter for iPhone,,https://pbs.twimg.com/media/C2OtWr0VQAEnS9r.jpg,2,west highland white terrier,2985,11536
820314633777061888,2017-01-14 17:00:24+00:00,"We are proud to support @LoveYourMelon on their mission to put a hat on every kid battling cancer. They are 14/10

https://t.co/XQlmPTLHPl https://t.co/ZNIkkHgtYE","https://www.loveyourmelon.com/pages/ourstory,https://twitter.com/dog_rates/status/820314633777061888/photo/1,https://twitter.com/dog_rates/status/820314633777061888/photo/1,https://twitter.com/dog_rates/status/820314633777061888/photo/1",14,10,,Twitter for iPhone,,https://pbs.twimg.com/media/C2JXyARUAAE4gbL.jpg,2,gordon setter,521,3149
819952236453363712,2017-01-13 17:00:21+00:00,"This is Oliver. He has dreams of being a service puppo so he can help his owner. 13/10 selfless af

make it happen:
https://t.co/f5WMsx0a9K https://t.co/6lJz0DKZIb","https://www.gofundme.com/servicedogoliver,https://twitter.com/dog_rates/status/819952236453363712/photo/1",13,10,Oliver,Twitter for iPhone,puppo,https://pbs.twimg.com/media/C2EONHNWQAUWxkP.jpg,1,american staffordshire terrier,1077,5001
819711362133872643,2017-01-13 01:03:12+00:00,This is Howie. He just bloomed. 11/10 revolutionary af https://t.co/m5fYxrO3IU,"https://twitter.com/dog_rates/status/819711362133872643/photo/1,https://twitter.com/dog_rates/status/819711362133872643/photo/1",11,10,Howie,Twitter for iPhone,,https://pbs.twimg.com/media/C2AzHjQWQAApuhf.jpg,2,toy poodle,2845,12547
819588359383371776,2017-01-12 16:54:26+00:00,This is Jazzy. She just found out that sandwich wasn't for her. Shocked and puppalled. 13/10 deep breaths Jazzy https://t.co/52cItP0vIO,https://twitter.com/dog_rates/status/819588359383371776/photo/1,13,10,Jazzy,Twitter for iPhone,,https://pbs.twimg.com/media/C1_DQn3UoAIoJy7.jpg,1,cardigan,1862,9113
819347104292290561,2017-01-12 00:55:47+00:00,Say hello to Anna and Elsa. They fall asleep in similar positions. It's pretty wild. Both 12/10 would snug simultaneously https://t.co/8rUL99bX4W,"https://twitter.com/dog_rates/status/819347104292290561/photo/1,https://twitter.com/dog_rates/status/819347104292290561/photo/1,https://twitter.com/dog_rates/status/819347104292290561/photo/1",12,10,Anna,Twitter for iPhone,,https://pbs.twimg.com/media/C17n1nrWQAIErU3.jpg,3,rottweiler,1110,6802
819227688460238848,2017-01-11 17:01:16+00:00,This is Finn. He's wondering if you come here often. Fr*ckin flirtatious af. 12/10 would give number to https://t.co/ii5eNX5LJT,https://twitter.com/dog_rates/status/819227688460238848/photo/1,12,10,Finn,Twitter for iPhone,,https://pbs.twimg.com/media/C157Oq3WQAEOyHm.jpg,1,border terrier,6193,21690
819004803107983360,2017-01-11 02:15:36+00:00,This is Bo. He was a very good First Doggo. 14/10 would be an absolute honor to pet https://t.co/AdPKrI8BZ1,"https://twitter.com/dog_rates/status/819004803107983360/photo/1,https://twitter.com/dog_rates/status/819004803107983360/photo/1,https://twitter.com/dog_rates/status/819004803107983360/photo/1,https://twitter.com/dog_rates/status/819004803107983360/photo/1",14,10,Bo,Twitter for iPhone,doggo,https://pbs.twimg.com/media/C12whDoVEAALRxa.jpg,1,standard poodle,34347,82248
818627210458333184,2017-01-10 01:15:10+00:00,Meet Wafer. He represents every fiber of my being. 13/10 very good dog https://t.co/I7bkhxBxUG,https://twitter.com/dog_rates/status/818627210458333184/photo/1,13,10,Wafer,Twitter for iPhone,,https://pbs.twimg.com/media/C1xZGkzWIAA8vh4.jpg,1,labrador retriever,7015,21134
818614493328580609,2017-01-10 00:24:38+00:00,This is Bear. He's a passionate believer of the outdoors. Leaves excite him. 12/10 would hug softly https://t.co/FOF0hBDxP8,"https://twitter.com/dog_rates/status/818614493328580609/photo/1,https://twitter.com/dog_rates/status/818614493328580609/photo/1,https://twitter.com/dog_rates/status/818614493328580609/photo/1,https://twitter.com/dog_rates/status/818614493328580609/photo/1",12,10,Bear,Twitter for iPhone,,https://pbs.twimg.com/media/C1xNgraVIAA3EVb.jpg,4,chihuahua,2339,9261
818536468981415936,2017-01-09 19:14:36+00:00,This is Tom. He's a silly dog. Known for his unconventional swing style. One h*ck of a sneaky tongue slip too. 11/10 would push https://t.co/6fSVcn9HAU,https://twitter.com/dog_rates/status/818536468981415936/photo/1,11,10,Tom,Twitter for iPhone,,https://pbs.twimg.com/media/C1wGkYoVQAAuC_O.jpg,1,welsh springer spaniel,2258,10220
818259473185828864,2017-01-09 00:53:55+00:00,This is Florence. He saw the same snap you sent him on your story. Pretty pupset with you. 12/10 https://t.co/rnkvT2kvib,https://twitter.com/dog_rates/status/818259473185828864/photo/1,12,10,Florence,Twitter for iPhone,,https://pbs.twimg.com/media/C1sKo_QUkAALtkw.jpg,1,miniature schnauzer,2069,10354
818145370475810820,2017-01-08 17:20:31+00:00,This is Autumn. Her favorite toy is a cheeseburger. She takes it everywhere. 11/10 https://t.co/JlPug12E5Z,"https://twitter.com/dog_rates/status/818145370475810820/photo/1,https://twitter.com/dog_rates/status/818145370475810820/photo/1,https://twitter.com/dog_rates/status/818145370475810820/photo/1",11,10,Autumn,Twitter for iPhone,,https://pbs.twimg.com/media/C1qi26rW8AMaj9K.jpg,1,golden retriever,2353,11551
817827839487737858,2017-01-07 20:18:46+00:00,This is Buddy. He ran into a glass door once. Now he's h*ckin skeptical. 13/10 empowering af (vid by Brittany Gaunt) https://t.co/q2BgNIi3OA,https://twitter.com/dog_rates/status/817827839487737858/video/1,13,10,Buddy,Twitter for iPhone,,https://pbs.twimg.com/ext_tw_video_thumb/817827663108771841/pu/img/e9oi839RGWJR37jF.jpg,1,cocker spaniel,24946,48317
817777686764523521,2017-01-07 16:59:28+00:00,"This is Dido. She's playing the lead role in ""Pupper Stops to Catch Snow Before Resuming Shadow Box with Dried Apple."" 13/10 (IG: didodoggo) https://t.co/m7isZrOBX7",https://twitter.com/dog_rates/status/817777686764523521/video/1,13,10,Dido,Twitter for iPhone,"doggo, pupper",https://pbs.twimg.com/ext_tw_video_thumb/817777588030476288/pu/img/KbuLpE4krHF4VdPf.jpg,1,curly-coated retriever,2509,10178
817536400337801217,2017-01-07 01:00:41+00:00,"Say hello to Eugene &amp; Patti Melt. No matter how dysfunctional they get, they will never top their owners. Both 12/10 would pet at same time https://t.co/jQUdvtdYMu","https://twitter.com/dog_rates/status/817536400337801217/photo/1,https://twitter.com/dog_rates/status/817536400337801217/photo/1,https://twitter.com/dog_rates/status/817536400337801217/photo/1,https://twitter.com/dog_rates/status/817536400337801217/photo/1",12,10,Eugene,Twitter for iPhone,,https://pbs.twimg.com/media/C1h4_MEXUAARxQF.jpg,2,pug,2713,11061
817423860136083457,2017-01-06 17:33:29+00:00,This is Ken. His cheeks are magic. 13/10 (IG: ken_shiba) https://t.co/btzf1zTDeQ,https://twitter.com/dog_rates/status/817423860136083457/video/1,13,10,Ken,Twitter for iPhone,,https://pbs.twimg.com/ext_tw_video_thumb/817423809049493505/pu/img/5OFW0yueFu9oTUiQ.jpg,1,samoyed,13496,31663
817415592588222464,2017-01-06 17:00:38+00:00,"Meet Strudel. He's rather h*ckin pupset that your clothes clash. 11/10 click the link to see how u can help Strudel

https://t.co/3uxgLz8d0l https://t.co/O0ECL1StB2","https://www.gofundme.com/help-strudel-walk-again?rcid=ec2be8b6f825461f8ee0fd5dcdf43fea,https://twitter.com/dog_rates/status/817415592588222464/photo/1",11,10,Strudel,Twitter for iPhone,,https://pbs.twimg.com/media/C1gLJVpWgAApI3r.jpg,1,doberman,884,5273
817171292965273600,2017-01-06 00:49:53+00:00,This is Tebow. He kindly requests that you put down the coffee and play with him. 13/10 such a good boy https://t.co/56uBP28eqw,https://twitter.com/dog_rates/status/817171292965273600/photo/1,13,10,Tebow,Twitter for iPhone,,https://pbs.twimg.com/media/C1cs8uAWgAEwbXc.jpg,1,golden retriever,1855,8262
817120970343411712,2017-01-05 21:29:55+00:00,Name a more iconic quartet... I'll wait. 13/10 for all https://t.co/kCLgD8687T,https://twitter.com/dog_rates/status/817120970343411712/photo/1,13,10,,Twitter for iPhone,,https://pbs.twimg.com/media/C1b_LSYUsAAJ494.jpg,1,saluki,2395,11490
817056546584727552,2017-01-05 17:13:55+00:00,This is Chloe. She fell asleep at the wheel. Absolute menace on the roadways. Sneaky tongue slip tho. 11/10 https://t.co/r6SLVN2VUH,https://twitter.com/dog_rates/status/817056546584727552/photo/1,11,10,Chloe,Twitter for iPhone,,https://pbs.twimg.com/media/C1bEl4zVIAASj7_.jpg,1,kelpie,1507,8104
816816676327063552,2017-01-05 01:20:46+00:00,This is Timber. He misses Christmas. Specifically the presents part. 12/10 cheer pup Timber https://t.co/dVVavqpeF9,https://twitter.com/dog_rates/status/816816676327063552/photo/1,12,10,Timber,Twitter for iPhone,,https://pbs.twimg.com/media/C1XqbhXXUAElpfI.jpg,1,malamute,1882,9430
