tweet_id,timestamp,text,expanded_urls,rating_numerator,rating_denominator,name,The Real Source,dog_type,jpg_url,img_num,breed,retweet_count,favorite_count
674737130913071104,2015-12-09 23:47:22+00:00,Meet Rufio. He is unaware of the pink legless pupper wrapped around him. Might want to get that checked 10/10 &amp; 4/10 https://t.co/KNfLnYPmYh,https://twitter.com/dog_rates/status/674737130913071104/photo/1,10,10,Rufio,Twitter for iPhone,pupper,https://pbs.twimg.com/media/CV0l10AU8AAfg-a.jpg,1,pomeranian,80,578
674670581682434048,2015-12-09 19:22:56+00:00,Meet Jeb &amp; Bush. Jeb is somehow stuck in that fence and Bush won't stop whispering sweet nothings in his ear. 9/10s https://t.co/NRNExUy9Hm,https://twitter.com/dog_rates/status/674670581682434048/photo/1,9,10,Jeb,Twitter for iPhone,,https://pbs.twimg.com/media/CVzpUGUWUAAo7Vn.jpg,1,malamute,563,1441
674646392044941312,2015-12-09 17:46:48+00:00,Two gorgeous dogs here. Little waddling dog is a rebel. Refuses to look at camera. Must be a preteen. 5/10 &amp; 8/10 https://t.co/YPfw7oahbD,https://twitter.com/dog_rates/status/674646392044941312/photo/1,5,10,,Twitter for iPhone,,https://pbs.twimg.com/media/CVzTUGrW4AAirJH.jpg,1,flat-coated retriever,427,1275
674644256330530816,2015-12-09 17:38:19+00:00,When you see sophomores in high school driving. 11/10 https://t.co/m6aC8d1Kzp,https://twitter.com/dog_rates/status/674644256330530816/photo/1,11,10,,Twitter for iPhone,,https://pbs.twimg.com/media/CVzRXmXWIAA0Fkr.jpg,1,basset,239,922
674638615994089473,2015-12-09 17:15:54+00:00,This pupper is fed up with being tickled. 12/10 I'm currently working on an elaborate heist to steal this dog https://t.co/F33n1hy3LL,https://twitter.com/dog_rates/status/674638615994089473/photo/1,12,10,,Twitter for iPhone,pupper,https://pbs.twimg.com/media/CVzMPh1UsAELQ_p.jpg,1,pomeranian,509,1510
674468880899788800,2015-12-09 06:01:26+00:00,This is Louis. He thinks he's flying. 13/10 this is a legendary pup https://t.co/6d9WziPXmx,"https://twitter.com/dog_rates/status/674468880899788800/photo/1,https://twitter.com/dog_rates/status/674468880899788800/photo/1",13,10,Louis,Twitter for iPhone,,https://pbs.twimg.com/media/CVwx3dQXAAA0ksL.jpg,2,chow,1768,5529
674447403907457024,2015-12-09 04:36:06+00:00,This pupper just wants a belly rub. This pupper has nothing to do w the tree being sideways now. 10/10 good pupper https://t.co/AyJ7Ohk71f,https://twitter.com/dog_rates/status/674447403907457024/photo/1,10,10,,Twitter for iPhone,pupper,https://pbs.twimg.com/media/CVweVUfW4AACPwI.jpg,1,brabancon griffon,314,952
674436901579923456,2015-12-09 03:54:22+00:00,Meet Bailey. She plays with her food. Very childish. Doesn't even need a battle helmet smh. Still cute though. 9/10 https://t.co/CLEOjxhTEx,https://twitter.com/dog_rates/status/674436901579923456/photo/1,9,10,Bailey,Twitter for iPhone,,https://pbs.twimg.com/media/CVwUyM9WwAAGDjv.jpg,1,shih-tzu,343,986
674422304705744896,2015-12-09 02:56:22+00:00,This is Ava. She doesn't understand flowers. 12/10 would caress firmly https://t.co/BxTJAFSIgk,https://twitter.com/dog_rates/status/674422304705744896/photo/1,12,10,Ava,Twitter for iPhone,,https://pbs.twimg.com/media/CVwHgblWcAACWOD.jpg,1,golden retriever,463,1281
674416750885273600,2015-12-09 02:34:18+00:00,This is Jonah. He's a Stinted Fisher Price. Enjoys chewing on his miniature RipStik. 10/10 very upbeat fellow https://t.co/7qjXy1uUYY,https://twitter.com/dog_rates/status/674416750885273600/photo/1,10,10,Jonah,Twitter for iPhone,,https://pbs.twimg.com/media/CVwCdCFW4AUHY4D.jpg,1,chihuahua,114,609
674410619106390016,2015-12-09 02:09:56+00:00,This is Lenny. He wants to be a sprinkler. 10/10 you got this Lenny https://t.co/CZ0YaB40Hn,https://twitter.com/dog_rates/status/674410619106390016/photo/1,10,10,Lenny,Twitter for iPhone,,https://pbs.twimg.com/media/CVv84VDUEAEm3dW.jpg,1,beagle,398,1066
674394782723014656,2015-12-09 01:07:00+00:00,This is Gary. He's a hide and seek champion. Second only to Kony. 8/10 Gary has a gift https://t.co/cAlB4XCcsi,https://twitter.com/dog_rates/status/674394782723014656/photo/1,8,10,Gary,Twitter for iPhone,,https://pbs.twimg.com/media/CVvueeeWwAUcQLR.jpg,1,lakeland terrier,487,1333
674291837063053312,2015-12-08 18:17:56+00:00,This is Kenny. He just wants to be included in the happenings. 11/10 https://t.co/2S6oye3XqK,https://twitter.com/dog_rates/status/674291837063053312/photo/1,11,10,Kenny,Twitter for iPhone,,https://pbs.twimg.com/media/CVuQ2LeUsAAIe3s.jpg,1,cardigan,5117,13122
674271431610523648,2015-12-08 16:56:51+00:00,"""AT DAWN, WE RIDE""
10/10 for both dogs https://t.co/3aXX6wH6it",https://twitter.com/dog_rates/status/674271431610523648/photo/1,10,10,,Twitter for iPhone,,https://pbs.twimg.com/media/CVt-SeMWwAAs9HH.jpg,1,german shepherd,640,1390
674269164442398721,2015-12-08 16:47:50+00:00,"This is Bob. He's a Juniper Fitzsimmons. His body is 2, but his face is 85. Always looks miserable. Nice stool. 8/10 https://t.co/vYe9RlVz2N",https://twitter.com/dog_rates/status/674269164442398721/photo/1,8,10,Bob,Twitter for iPhone,,https://pbs.twimg.com/media/CVt8OmIWIAAbxvJ.jpg,1,pug,201,821
674262580978937856,2015-12-08 16:21:41+00:00,This is Gus. He's super stoked about being an elephant. Couldn't be happier. 9/10 for elephant pupper https://t.co/gJS1qU0jP7,https://twitter.com/dog_rates/status/674262580978937856/photo/1,9,10,Gus,Twitter for iPhone,pupper,https://pbs.twimg.com/media/CVt2PawWIAEUkqW.jpg,1,greater swiss mountain dog,380,1175
674255168825880576,2015-12-08 15:52:13+00:00,Say hello to Bobbay. He's a marshmallow wizard. 10/10 https://t.co/r6LZN1o1Gx,https://twitter.com/dog_rates/status/674255168825880576/photo/1,10,10,Bobbay,Twitter for iPhone,,https://pbs.twimg.com/media/CVtvf6bWwAAd1rT.jpg,1,eskimo dog,463,1294
674082852460433408,2015-12-08 04:27:30+00:00,This is a Sagitariot Baklava mix. Loves her new hat. 11/10 radiant pup https://t.co/Bko5kFJYUU,https://twitter.com/dog_rates/status/674082852460433408/photo/1,11,10,,Twitter for iPhone,,https://pbs.twimg.com/media/CVrSxy7WsAAFD2F.jpg,1,pomeranian,144,678
674075285688614912,2015-12-08 03:57:26+00:00,Say hello to Mitch. He thinks that's a hat. Nobody has told him yet. 11/10 please no one tell him https://t.co/7jOPktauh4,https://twitter.com/dog_rates/status/674075285688614912/photo/1,11,10,Mitch,Twitter for iPhone,,https://pbs.twimg.com/media/CVrL5YBWoAA_uPD.jpg,1,airedale,245,886
674053186244734976,2015-12-08 02:29:37+00:00,"This is Stanley. Yes he is aware of the spoon's presence, he just doesn't know what he should do about it. 10/10 https://t.co/gQAMg5ypW5",https://twitter.com/dog_rates/status/674053186244734976/photo/1,10,10,Stanley,Twitter for iPhone,,https://pbs.twimg.com/media/CVq3zAaWwAA8vpk.jpg,1,cardigan,1121,2936
674051556661161984,2015-12-08 02:23:09+00:00,This is Lucy. She knits. Specializes in toboggans. 10/10 I'd buy a toboggan from Lucy https://t.co/YE2XDHy4Yk,https://twitter.com/dog_rates/status/674051556661161984/photo/1,10,10,Lucy,Twitter for iPhone,,https://pbs.twimg.com/media/CVq2UHwWEAAduMw.jpg,1,shih-tzu,428,1288
674042553264685056,2015-12-08 01:47:22+00:00,Yea I can't handle the cuteness anymore. Curls for days. 12/10 for all https://t.co/sAI6gCGZYX,https://twitter.com/dog_rates/status/674042553264685056/photo/1,12,10,,Twitter for iPhone,,https://pbs.twimg.com/media/CVquIDRW4AEJrPk.jpg,1,toy poodle,109,634
674038233588723717,2015-12-08 01:30:12+00:00,This is Kaiya. She's an aspiring shoe model. 12/10 follow your dreams pupper https://t.co/nX8FiGRHvk,https://twitter.com/dog_rates/status/674038233588723717/photo/1,12,10,Kaiya,Twitter for iPhone,pupper,https://pbs.twimg.com/media/CVqqMtiVEAEye_L.jpg,1,eskimo dog,366,975
674036086168010753,2015-12-08 01:21:40+00:00,Meet Daisy. She has no eyes &amp; her face has been blurry since birth. Quite the trooper tho. Still havin a blast. 9/10 https://t.co/jcNdw43BIP,https://twitter.com/dog_rates/status/674036086168010753/photo/1,9,10,Daisy,Twitter for iPhone,,https://pbs.twimg.com/media/CVqoPslWEAEk7EC.jpg,1,toy poodle,180,758
674024893172875264,2015-12-08 00:37:11+00:00,When you realize it doesn't matter how hard you study. You're still going to fail. 10/10 https://t.co/qzYXbyv0SJ,https://twitter.com/dog_rates/status/674024893172875264/photo/1,10,10,,Twitter for iPhone,,https://pbs.twimg.com/media/CVqeEKLW4AA1wXH.jpg,1,pomeranian,1079,1577
674019345211760640,2015-12-08 00:15:09+00:00,This is Acro. You briefly see her out of the corner of your eye. You look and she's not there. 10/10 mysterious pup https://t.co/fqiEsTduEs,https://twitter.com/dog_rates/status/674019345211760640/photo/1,10,10,Acro,Twitter for iPhone,,https://pbs.twimg.com/media/CVqZBO8WUAAd931.jpg,1,collie,264,1009
674014384960745472,2015-12-07 23:55:26+00:00,Say hello to Aiden. His eyes are magical. Loves his little Guy Fieri friend. Sneaky tongue slip. 11/10 would caress https://t.co/Ac37LOe3xD,https://twitter.com/dog_rates/status/674014384960745472/photo/1,11,10,Aiden,Twitter for iPhone,,https://pbs.twimg.com/media/CVqUgTIUAAUA8Jr.jpg,1,pembroke,557,1382
673956914389192708,2015-12-07 20:07:04+00:00,This is one esteemed pupper. Just graduated college. 10/10 what a champ https://t.co/nyReCVRiyd,https://twitter.com/dog_rates/status/673956914389192708/photo/1,10,10,,Twitter for iPhone,pupper,https://pbs.twimg.com/media/CVpgPGwWoAEV7gG.jpg,1,pug,832,1740
673919437611909120,2015-12-07 17:38:09+00:00,This is Obie. He is on guard watching for evildoers from the comfort of his pumpkin. Very brave pupper. 11/10 https://t.co/cdwPTsGEAb,https://twitter.com/dog_rates/status/673919437611909120/photo/1,11,10,Obie,Twitter for iPhone,pupper,https://pbs.twimg.com/media/CVo-JuMWwAAet6F.jpg,1,schipperke,325,1055
673906403526995968,2015-12-07 16:46:21+00:00,Guys I'm getting real tired of this. We only rate dogs. Please don't send in other things like this Bulbasaur. 3/10 https://t.co/t5rQHl6W8M,https://twitter.com/dog_rates/status/673906403526995968/photo/1,3,10,,Twitter for iPhone,,https://pbs.twimg.com/media/CVoySqoWUAAWb7N.jpg,1,soft-coated wheaten terrier,1426,2835
673887867907739649,2015-12-07 15:32:42+00:00,When you're having a great time sleeping and your mom comes in and turns on the lights. 10/10 https://t.co/6qYd6BNSPd,"https://twitter.com/dog_rates/status/673887867907739649/photo/1,https://twitter.com/dog_rates/status/673887867907739649/photo/1",10,10,,Twitter for iPhone,,https://pbs.twimg.com/media/CVoha_IU4AAZ7vi.jpg,2,brabancon griffon,220,838
673711475735838725,2015-12-07 03:51:47+00:00,ðŸŽ¶ HELLO FROM THE OTHER SIIIIIIIIDE ðŸŽ¶ 10/10 https://t.co/MTOOksRzvH,https://twitter.com/dog_rates/status/673711475735838725/photo/1,10,10,,Twitter for iPhone,,https://pbs.twimg.com/media/CVmA_osW4AArAU1.jpg,1,maltese dog,263,935
673709992831262724,2015-12-07 03:45:53+00:00,I know a lot of you are studying for finals. Good luck! Here's this. It should help somehow. 12/10 https://t.co/s2ktuPQd79,https://twitter.com/dog_rates/status/673709992831262724/photo/1,12,10,,Twitter for iPhone,,https://pbs.twimg.com/media/CVl_qbjW4AA8Mam.jpg,1,chihuahua,234,744
673708611235921920,2015-12-07 03:40:24+00:00,This is Riley. She's just an adorable football fan. 12/10 I'd watch the sports with her https://t.co/kLV8zUCfc8,https://twitter.com/dog_rates/status/673708611235921920/photo/1,12,10,Riley,Twitter for iPhone,,https://pbs.twimg.com/media/CVl-Z0dWcAAs7wr.jpg,1,golden retriever,253,949
673707060090052608,2015-12-07 03:34:14+00:00,This is Raymond. He's absolutely terrified of floating tennis ball. 10/10 it'll be ok pupper https://t.co/QyH1CaY3SM,"https://twitter.com/dog_rates/status/673707060090052608/photo/1,https://twitter.com/dog_rates/status/673707060090052608/photo/1",10,10,Raymond,Twitter for iPhone,pupper,https://pbs.twimg.com/media/CVl8_EPWoAAcuSC.jpg,1,german short-haired pointer,344,985
673705679337693185,2015-12-07 03:28:45+00:00,This is Dot. He found out you only pretended to throw the ball that one time. You don't fuck with Dot. 8/10 https://t.co/Ymg4fwKlZd,https://twitter.com/dog_rates/status/673705679337693185/photo/1,8,10,Dot,Twitter for iPhone,,https://pbs.twimg.com/media/CVl7u00WcAAufzR.jpg,1,shih-tzu,357,1123
673689733134946305,2015-12-07 02:25:23+00:00,When you're having a blast and remember tomorrow's Monday. 11/10 https://t.co/YPsJasNVGe,"https://twitter.com/dog_rates/status/673689733134946305/photo/1,https://twitter.com/dog_rates/status/673689733134946305/photo/1",11,10,,Twitter for iPhone,,https://pbs.twimg.com/media/CVltNgxWEAA5sCJ.jpg,1,chesapeake bay retriever,566,1534
673688752737402881,2015-12-07 02:21:29+00:00,Meet Larry. He doesn't know how to shoe. 9/10 damn it Larry https://t.co/jMki5GOV3y,https://twitter.com/dog_rates/status/673688752737402881/photo/1,9,10,Larry,Twitter for iPhone,,https://pbs.twimg.com/media/CVlsVs3WIAAja6m.jpg,1,soft-coated wheaten terrier,436,1122
673686845050527744,2015-12-07 02:13:55+00:00,This is George. He's upset that the 4th of July isn't everyday. 11/10 https://t.co/wImU0jdx3E,https://twitter.com/dog_rates/status/673686845050527744/photo/1,11,10,George,Twitter for iPhone,,https://pbs.twimg.com/media/CVlqi_AXIAASlcD.jpg,1,pekinese,374,1270
673680198160809984,2015-12-07 01:47:30+00:00,This is Shnuggles. I would kill for Shnuggles. 13/10 https://t.co/GwvpQiQ7oQ,https://twitter.com/dog_rates/status/673680198160809984/photo/1,13,10,Shnuggles,Twitter for iPhone,,https://pbs.twimg.com/media/CVlkid8WoAAqDlB.jpg,1,samoyed,414,1225
673662677122719744,2015-12-07 00:37:52+00:00,This is Kendall. 12/10 would cuddle the hell out of https://t.co/fJulMurnfj,https://twitter.com/dog_rates/status/673662677122719744/photo/1,12,10,Kendall,Twitter for iPhone,,https://pbs.twimg.com/media/CVlUfBbUwAQyfcD.jpg,1,labrador retriever,326,1125
673656262056419329,2015-12-07 00:12:23+00:00,This is Albert AKA King Banana Peel. He's a kind ruler of the kitchen. Very jubilant pupper. 10/10 overall great dog https://t.co/PN8hxgZ9We,https://twitter.com/dog_rates/status/673656262056419329/photo/1,10,10,Albert,Twitter for iPhone,pupper,https://pbs.twimg.com/media/CVlOy3pW4AQ9H1K.jpg,1,bull mastiff,198,649
673636718965334016,2015-12-06 22:54:44+00:00,This is a Lofted Aphrodisiac Terrier named Kip. Big fan of bed n breakfasts. Fits perfectly. 10/10 would pet firmly https://t.co/gKlLpNzIl3,https://twitter.com/dog_rates/status/673636718965334016/photo/1,10,10,,Twitter for iPhone,,https://pbs.twimg.com/media/CVk9ApFWUAA-S1s.jpg,1,pug,307,992
673612854080196609,2015-12-06 21:19:54+00:00,This is Jeffri. He's a speckled ice pupper. Very lazy. Enjoys the occasional swim. Rather majestic really. 7/10 https://t.co/0iyItbtkr8,https://twitter.com/dog_rates/status/673612854080196609/photo/1,7,10,Jeffri,Twitter for iPhone,pupper,https://pbs.twimg.com/media/CVknUTlVEAARjU5.jpg,1,newfoundland,629,1420
673583129559498752,2015-12-06 19:21:47+00:00,This is Sandy. She loves her spot by the tree. Contemplating her true purpose in the universe. Wears socks. 11/10 https://t.co/JpoEvgbDug,https://twitter.com/dog_rates/status/673583129559498752/photo/1,11,10,Sandy,Twitter for iPhone,,https://pbs.twimg.com/media/CVkMRUeWsAA9bMh.jpg,1,golden retriever,312,1059
673580926094458881,2015-12-06 19:13:01+00:00,When you ask your professor about extra credit on the last day of class. 8/10 https://t.co/H6rqZyE4NP,https://twitter.com/dog_rates/status/673580926094458881/photo/1,8,10,,Twitter for iPhone,,https://pbs.twimg.com/media/CVkKRqOXIAEX83-.jpg,1,beagle,237,731
673359818736984064,2015-12-06 04:34:25+00:00,This is Steve. He was just relaxing in hot tub when he was intruded upon. 8/10 poor little pup https://t.co/EPq0MRAraJ,https://twitter.com/dog_rates/status/673359818736984064/photo/1,8,10,Steve,Twitter for iPhone,,https://pbs.twimg.com/media/CVhBLohWEAAXtYl.jpg,1,english setter,590,1281
673355879178194945,2015-12-06 04:18:46+00:00,This is Koda. She's a boss. Helps shift gears. Can even drive herself. Still no seat belt (reckless af). 11/10 https://t.co/0zUxlrhZrQ,"https://twitter.com/dog_rates/status/673355879178194945/photo/1,https://twitter.com/dog_rates/status/673355879178194945/photo/1,https://twitter.com/dog_rates/status/673355879178194945/photo/1",11,10,Koda,Twitter for iPhone,,https://pbs.twimg.com/media/CVg9mTYWIAAu7J6.jpg,1,rottweiler,489,1332
673352124999274496,2015-12-06 04:03:51+00:00,*lets out a tiny screech and then goes into complete cardiac arrest* 12/10 https://t.co/az5PLGzVNJ,https://twitter.com/dog_rates/status/673352124999274496/photo/1,12,10,,Twitter for iPhone,,https://pbs.twimg.com/media/CVg6L2hWIAAYuEb.jpg,1,golden retriever,471,1489
673350198937153538,2015-12-06 03:56:12+00:00,This is Bella. She's a Genghis Flopped Canuck. Stuck in trash can. 9/10 not to happy about it https://t.co/RMv9EAv57u,https://twitter.com/dog_rates/status/673350198937153538/photo/1,9,10,Bella,Twitter for iPhone,,https://pbs.twimg.com/media/CVg4bo8WEAANEEE.jpg,1,west highland white terrier,183,680
673345638550134785,2015-12-06 03:38:05+00:00,This is Gerald. He's a fluffy lil yellow pup. Always looks like his favorite team just lost on a hail mary. 7/10 https://t.co/GpSkpN8kXS,https://twitter.com/dog_rates/status/673345638550134785/photo/1,7,10,Gerald,Twitter for iPhone,,https://pbs.twimg.com/media/CVg0SVRWEAAsBrS.jpg,1,pomeranian,1096,2221
673343217010679808,2015-12-06 03:28:27+00:00,IT'S SO SMALL ERMERGERF 11/10 https://t.co/dNUbKOSiWW,https://twitter.com/dog_rates/status/673343217010679808/photo/1,11,10,,Twitter for iPhone,,https://pbs.twimg.com/media/CVgyFSyU4AA9p1e.jpg,1,chihuahua,234,853
673342308415348736,2015-12-06 03:24:51+00:00,This is Django. He's a skilled assassin pupper. 10/10 https://t.co/w0YTuiRd1a,https://twitter.com/dog_rates/status/673342308415348736/photo/1,10,10,Django,Twitter for iPhone,pupper,https://pbs.twimg.com/media/CVgxQc5XIAAYL0W.jpg,1,chihuahua,490,1125
673320132811366400,2015-12-06 01:56:44+00:00,This is Frankie. He's wearing blush. 11/10 really accents the cheek bones https://t.co/iJABMhVidf,"https://twitter.com/dog_rates/status/673320132811366400/photo/1,https://twitter.com/dog_rates/status/673320132811366400/photo/1,https://twitter.com/dog_rates/status/673320132811366400/photo/1,https://twitter.com/dog_rates/status/673320132811366400/photo/1",11,10,Frankie,Twitter for iPhone,,https://pbs.twimg.com/media/CVgdFjNWEAAxmbq.jpg,3,samoyed,6841,11908
673317986296586240,2015-12-06 01:48:12+00:00,Take a moment and appreciate how these two dogs fell asleep. Simply magnificent. 10/10 for both https://t.co/juX48bWpng,"https://twitter.com/dog_rates/status/673317986296586240/photo/1,https://twitter.com/dog_rates/status/673317986296586240/photo/1",10,10,,Twitter for iPhone,,https://pbs.twimg.com/media/CVgbIobUYAEaeI3.jpg,2,miniature pinscher,215,775
673295268553605120,2015-12-06 00:17:55+00:00,Meet Eve. She's a raging alcoholic 8/10 (would b 11/10 but pupper alcoholism is a tragic issue that I can't condone) https://t.co/U36HYQIijg,https://twitter.com/dog_rates/status/673295268553605120/photo/1,8,10,Eve,Twitter for iPhone,pupper,https://pbs.twimg.com/media/CVgGc9hWIAIe1bn.jpg,1,golden retriever,2733,6698
673270968295534593,2015-12-05 22:41:22+00:00,This is Mac. His dad's probably a lawyer. 11/10 https://t.co/mjC0QpXGum,https://twitter.com/dog_rates/status/673270968295534593/photo/1,11,10,Mac,Twitter for iPhone,,https://pbs.twimg.com/media/CVfwXuWWIAAqnoi.jpg,1,shih-tzu,311,952
673240798075449344,2015-12-05 20:41:29+00:00,Magical floating dog here. Very calm. Always hangs by the pond. Rather moist. Good listener. 6/10 personally I'd pet https://t.co/1euKoOvy49,https://twitter.com/dog_rates/status/673240798075449344/photo/1,6,10,,Twitter for iPhone,,https://pbs.twimg.com/media/CVfU7KLXAAAAgIa.jpg,1,airedale,613,1269
673213039743795200,2015-12-05 18:51:11+00:00,This is Dexter. He just got some big news. 10/10 https://t.co/CbvCUE6PFI,https://twitter.com/dog_rates/status/673213039743795200/photo/1,10,10,Dexter,Twitter for iPhone,,https://pbs.twimg.com/media/CVe7r7QVEAAc4Bg.jpg,1,schipperke,723,1962
672997845381865473,2015-12-05 04:36:04+00:00,Say hello to Kenzie. She is a fluff ball. 12/10 you'd need to taser me for me to let go of her https://t.co/dph1UHNJrg,https://twitter.com/dog_rates/status/672997845381865473/photo/1,12,10,Kenzie,Twitter for iPhone,,https://pbs.twimg.com/media/CVb39_1XIAAMoIv.jpg,1,chow,629,1746
672995267319328768,2015-12-05 04:25:50+00:00,This is Pumpkin. He can look in two different directions at once. Great with a screwdriver. 8/10 https://t.co/odpuqtz2Fq,https://twitter.com/dog_rates/status/672995267319328768/photo/1,8,10,Pumpkin,Twitter for iPhone,,https://pbs.twimg.com/media/CVb1mRiWcAADBsE.jpg,1,french bulldog,250,841
672988786805112832,2015-12-05 04:00:04+00:00,This is Schnozz. He's had a blurred tail since birth. Hasn't let that stop him. 10/10 inspirational pupper https://t.co/a3zYMcvbXG,https://twitter.com/dog_rates/status/672988786805112832/photo/1,10,10,Schnozz,Twitter for iPhone,pupper,https://pbs.twimg.com/media/CVbvjKqW4AA_CuD.jpg,1,lakeland terrier,253,873
672980819271634944,2015-12-05 03:28:25+00:00,Extraordinary dog here. Looks large. Just a head. No body. Rather intrusive. 5/10 would still pet https://t.co/ufHWUFA9Pu,https://twitter.com/dog_rates/status/672980819271634944/photo/1,5,10,,Twitter for iPhone,,https://pbs.twimg.com/media/CVbodBOUsAAb7jZ.jpg,1,basset,883,1622
672975131468300288,2015-12-05 03:05:49+00:00,This is Chuckles. He is one skeptical pupper. 10/10 stay woke Chuckles https://t.co/ZlcF0TIRW1,https://twitter.com/dog_rates/status/672975131468300288/photo/1,10,10,Chuckles,Twitter for iPhone,pupper,https://pbs.twimg.com/media/CVbjRSIWsAElw2s.jpg,1,pug,773,1491
672968025906282496,2015-12-05 02:37:35+00:00,This is Gustaf. He's a purebred Chevy Equinox. Loves to shred. Gnarly lil pup. Great with the babes. 11/10 https://t.co/7CbO2eMAgJ,https://twitter.com/dog_rates/status/672968025906282496/photo/1,11,10,Gustaf,Twitter for iPhone,,https://pbs.twimg.com/media/CVbc2V2WsAE3-kn.jpg,1,toy poodle,465,1179
672964561327235073,2015-12-05 02:23:49+00:00,This is Terry. He's a Toasty Western Sriracha. Doubles as a table. Great for parties. 10/10 would highly recommend https://t.co/1ui7a1ZLTT,https://twitter.com/dog_rates/status/672964561327235073/photo/1,10,10,Terry,Twitter for iPhone,,https://pbs.twimg.com/media/CVbZsouWUAIsxMc.jpg,1,chihuahua,553,1261
672877615439593473,2015-12-04 20:38:19+00:00,This is Oscar. He's getting bombarded with the snacks. Not sure he's happy about it. 8/10 for Oscar https://t.co/dJHI7uC2y3,https://twitter.com/dog_rates/status/672877615439593473/photo/1,8,10,Oscar,Twitter for iPhone,,https://pbs.twimg.com/media/CVaKn75XAAEU09u.jpg,1,chihuahua,297,906
672834301050937345,2015-12-04 17:46:12+00:00,"This is Ed. He's not mad, just disappointed. 10/10 https://t.co/BIljU0zhLN",https://twitter.com/dog_rates/status/672834301050937345/photo/1,10,10,Ed,Twitter for iPhone,,https://pbs.twimg.com/media/CVZjOktVAAAtigw.jpg,1,pembroke,501,1152
672640509974827008,2015-12-04 04:56:09+00:00,This is Leonidas. He just got rekt by a snowball. 9/10 doggy down https://t.co/uNrmYDUa9M,https://twitter.com/dog_rates/status/672640509974827008/photo/1,9,10,Leonidas,Twitter for iPhone,,https://pbs.twimg.com/media/CVWy9v-VAAALSoE.jpg,1,chesapeake bay retriever,270,873
672622327801233409,2015-12-04 03:43:54+00:00,This lil pupper is sad because we haven't found Kony yet. RT to spread awareness. 12/10 would pet firmly https://t.co/Cv7dRdcMvQ,https://twitter.com/dog_rates/status/672622327801233409/photo/1,12,10,,Twitter for iPhone,pupper,https://pbs.twimg.com/media/CVWicBbUYAIomjC.jpg,1,golden retriever,418,1147
672604026190569472,2015-12-04 02:31:10+00:00,This is a baby Rand Paul. Curls for days. 11/10 would cuddle the hell out of https://t.co/xHXNaPAYRe,https://twitter.com/dog_rates/status/672604026190569472/photo/1,11,10,,Twitter for iPhone,,https://pbs.twimg.com/media/CVWRyylWIAAMltv.jpg,1,toy poodle,334,963
672594978741354496,2015-12-04 01:55:13+00:00,Meet Scott. Just trying to catch his train to work. Doesn't need everybody staring. 9/10 ignore the haters pupper https://t.co/jyXbZ35MYz,https://twitter.com/dog_rates/status/672594978741354496/photo/1,9,10,Scott,Twitter for iPhone,pupper,https://pbs.twimg.com/media/CVWJkJXWsAInlZl.jpg,1,great pyrenees,527,1171
672591762242805761,2015-12-04 01:42:26+00:00,This is Taz. He boxes leaves. 10/10 https://t.co/bWQ0iIcP0w,https://twitter.com/dog_rates/status/672591762242805761/photo/1,10,10,Taz,Twitter for iPhone,,https://pbs.twimg.com/media/CVWGotpXAAMRfGq.jpg,1,kuvasz,281,840
672538107540070400,2015-12-03 22:09:14+00:00,Meet Darby. He's a Fiscal Tutankhamen Waxbeard. Really likes steak. 7/10 https://t.co/rSndxTL0Ap,https://twitter.com/dog_rates/status/672538107540070400/photo/1,7,10,Darby,Twitter for iPhone,,https://pbs.twimg.com/media/CVVV1wJWoAEcOyk.jpg,1,chihuahua,315,895
672523490734551040,2015-12-03 21:11:09+00:00,When she says she'll be ready in a minute but you've been waiting in the car for almost an hour. 10/10 https://t.co/EH0N3dFKUi,https://twitter.com/dog_rates/status/672523490734551040/photo/1,10,10,,Twitter for iPhone,,https://pbs.twimg.com/media/CVVIjGbWwAAxkN0.jpg,1,golden retriever,146,551
672488522314567680,2015-12-03 18:52:12+00:00,"This is Jackie. She was all ready to go out, but her friends just cancelled on her. 10/10 hang in there Jackie https://t.co/rVfi6CCidK",https://twitter.com/dog_rates/status/672488522314567680/photo/1,10,10,Jackie,Twitter for iPhone,,https://pbs.twimg.com/media/CVUovvHWwAAD-nu.jpg,1,doberman,371,989
672482722825261057,2015-12-03 18:29:09+00:00,This is light saber pup. Ready to fight off evil with light saber. 10/10 true hero https://t.co/LPPa3btIIt,https://twitter.com/dog_rates/status/672482722825261057/photo/1,10,10,,Twitter for iPhone,,https://pbs.twimg.com/media/CVUjd14W4AE8tvO.jpg,1,west highland white terrier,517,988
